Title,Rating,Review
Spotlight, 4.0, Le bon coté du cinéma américain ; un film enquête tout en finesse et en pudeur.2001, le nouveau rédacteur en chef du « Boston Globe » demande qu’une enquête de mœurs impliquant un prêtre catholique, quelque peu bâclée il y a quelques années, soit reprise. La cellule d’investigation nommée « spotlight » est chargée de cette enquête.Le film suit donc les investigations de cette équipe de quatre reporters aguerris. Ils tentent d’abord de démontrer que le cardinal Law de Boston était impliqué, puis, sous l’impulsion du même rédacteur en chef, de démontrer que ce phénomène de pédophilie est systémique … Ce sujet extrêmement délicat a secoué violemment l’église, l’aborder était donc délicat. Tom McCarthy relève brillamment ce défi. La charge violente est évitée subtilement pour laisser place a un discernement loyal. La démarche est honnête n’occultant pas les atermoiements au sein même de la rédaction du journal, comme les petits arrangements lucratifs proposés aux victimes par des hommes de loi sans scrupules. En même temps que l’ampleur du phénomène, le spectateur découvre aussi le drame existentiel auquel les victimes étaient et sont encore confrontées. Une omerta donc expliquée par la désorientation des croyants dépossédés de leur foi.
Mia Madre, 1.0, Comme un puzzle dont les pièces ne s’ajustent pas … Toutes les pièces correspondent aux marottes habituelles de Nani Moretti ; la satire sociale dépeinte à travers les difficultés d’une réalisatrice de cinéma qui tourne un film « engagé » non sans difficultés ; l’introspection familiale incarnée par le frère de cette réalisatrice et interprété par Moretti lui-même et pour se conformer à la tradition de comédia del arte , une partie comique incarnée par un acteur ingérable, rôle principal du film tourné par la réalisatrice. Ce triptyque fonctionne ou plutôt dysfonctionne à cause de la fin de vie de la mère de la réalisatrice. Voilà l’idée du film de Nani Moretti … Peut-être était-ce une bonne idée mais rien ne fonctionne. La satire sociale ressemble plus à une pastille décorative et n’est jamais fouillée. L’introspection familiale est sans doute la partie qui aurait pu être la plus pertinente. Mais on s’aperçoit très vire que Moretti s’est adjugé un rôle sur mesure parangon de modération et de sagesse et ENORME écueil, jamais la personnalité de la maman mourante n’est abordée. Reste la partie comique laissée totalement aux mains délirantes d’un John Turturo qui peine a donner de l’épaisseur à son personnage tellement il semble abandonné ! Voilà, aucune pièce ne semble en cohérence avec les autres. Une impression d’inutilité totale suinte de ce film ennuyeux à mourir qui n’a même pas la force d’être révoltant.
L'étreinte du serpent, 4.0, L'histoire de la dérive de deux aventuriers à 40 ans d'écart le long du même fleuve amazonien ; l'histoire de la confrontation du matérialisme du colon et la spiritualité de l'indigène ; l'histoire de la dérive du prosélytisme.Le film débute par une - même deux - quêtes initiatiques, tournées vers le pouvoir du chamanisme, une recherche absolue du message de la nature intacte. Au fil du fleuve, le discours devient de plus en plus politique, de plus en plus critique de l'homme blanc. Le paroxysme est atteint à la découverte d'une mission en totale dérive (on pourrait y voir une critique acerbe de toute dérive extrémiste dans les religions ...) ... et c'est alors que le récit se délite quelque peu dans des arcanes peu maitrisées. Reste une oeuvre attachante grâce à une totale maitrise de la forme, des décors naturels somptueux ... mais sans le souffle épique de Aguirre. Le voyage vers un ésotérisme échevelé reste timide et peu enthousiasmant.
Demain, 4.0, Quand, comme moi, on considère que ceux qui pensent que la planète peut être sauvée pour des optimistes béats, parce que l'on n'entrevoit pas de solutions ... Quand on ne comprend pas toujours l'utilité de certaines expériences ... ce film est un bain de jouvence. Tout est clair, didactique et pédagogique. Bien sûr, on peut opposer le fait que c'est même un peu trop lumineux, voire orienté pour nous rassurer mais le but est atteint ; l'espoir en l'homme et sa force de survie pourrait faire bouger les montagnes !! Petit bémol : des traductions parfois approximatives qui faussent les données ! Ex : 9$ le mètre cube de compost au lieu de yard-cube ! Ca fait presque 10 fois plus cher quand même !
21 nuits avec Pattie, 2.0, Je n’avais pas vu (entendu !) un film aussi bavard depuis « Alceste à bicyclette » ! Sauf que dans ce dernier cas, la langue – de Molière ou pas – était au centre du sujet. Ici, cela ressemble à un viatique qui ne sert en rien le propos ! Une forte dose d’afféteries dans la première partie du film, rend le propos indigeste. Première partie destinée à camper une espèce de communauté libertaire idéale, post-soixantuitarde dans une « Montagne Noire » fantasmée. A l’apparition tardive d’André Dussolier, le film tente l’impossible ; expliquer voire exonérer une des plus puissantes déviance sexuelle ! Explication un temps trouvée dans les fantasmes de couguar rêveuse d’Isabelle Carrée, quadragénaire coincée. Il faut dire que la délicieuse pornographie verbale du personnage campé par Karin Viard, est forcement suggestif ! C’est bien essayé et même assez habile. Le film a l’énorme avantage de finalement, raconter la nécessité de cultiver le désir … même quand il est transgressif ?
Ixcanul, 4.0, Un premier film guatémaltèque tourné en cakchiquel, c’est assez inhabituel … et le résultat assez académique pourtant. Une famille de journaliers d’une plantation de café survit comme elle peut à l’ombre d'un volcan (Ixcanul en cakchiquel).Au delà de l’histoire assez convenue, la description de la précarité de cette famille est poignante. Alors la spiritualité, l’invocation des esprits, la tendresse mère/fille prennent tous leur sens. Et c’est bien la force du film ; ce sens terre à terre des intérêts de la survie auxquels se mêlent les forces fantastiques ou surnaturelles. Les tensions célestes et terrestres se joignent pour donner a ce mélodrame familial une authenticité presque documentaire. Un superbe fil tendu entre des sentiments bouleversants et les conséquences d’une réalité féroce.
Nous trois ou rien, 2.0, Introduire du comique dans un scénario tragique n'est, semble-t-il, pas donné à tout le monde ! Des pointes d'humour très fin sont gâchées par des calembours grotesques. De ce fait, le film ne trouve pas "son" ton et je n'ai pas pu "entrer" dans l'histoire. Il manque une réelle cohérence de traitement et le résultat est un film un peu "foutrac" avec des scènes délicieuses, il est vrai !Leïla Bekthi est magnifique et totalement convaincante ... comme d'habitude.
Vers l'autre rive, 1.0, Cela doit être extrêmement poétique ... mais je n'y ai pas été sensible. Dès le départ, la photo trop terne, la tenue vestimentaire du rôle principal, morne à pleurer, m'ont laissé sur le bord ... Je m'y suis ennuyé ferme ... cafaaaaaaard !
Les Deux amis, 3.0, Louis Garrel (Abel) et Vincent Macaigne (Clément) campent donc deux amis … mais attention amis jusqu’à la fusion, sans tiédeur. Ils se protègent, se mentent éhontément pour ne pas se blesser. Mais parmi leurs rêveries de littérature pour l’un, de cinéma pour l’autre, vient s’immiscer Mina. Mystérieuse, fuyante, belle à pleurer, l’empathique Clément n’y résiste pas. Il faut dire qu’elle est interprétée par Golshifteh Farahani … magnifique et envoutante. Les dialogues sont percutants, les situations souvent burlesques dans les outrances dramatiques. La mise en scène académique dénote avec l’atmosphère irréelle créée par l’opposition de la légèreté de la situation et la gravité de ses implications. Au bilan, un film attachant, bourré de défaut que la grâce de Golshifteh Farahani sauve magnifiquement.
Youth, 5.0, Un hôtel luxueux situé dans une station suisse dans un milieu alpestre magnifique ; le décor est planté. Si l’établissement est lui-même un acteur important du film, on y voit évoluer un florilège de gloires féminines, masculines, jeunes, vieilles … dont les deux principaux sont un chef d’orchestre désabusé à la retraite et un metteur en scène venu mettre au point sa dernière œuvre. Le premier est campé par le magnifique Michael Caine à l’ironie anglaise aussi grinçante que savoureuse et le deuxième par Harvey Keitel. C’est un film magnifique d’abord grâce à l’enchainement de plans à la force esthétique indiscutable qui pour être conçus par le subconscient du réalisateur, font écho à celui du spectateur. Ensuite parce que le discours sur la fuite du temps est intimement émouvant, ramène à des émotions précieuses. Que reste-t-il de ce que l’on a enseigné ? Que reste-t-il de ce que l’on a été ? Quel regard poser dans le rétroviseur ?
Cemetery of Splendour, 4.0, En 2010 Apichatpong Weerasethakul m’avait plus que surpris avec sa palme d’or ; Oncle Boonme. Je m’attendais donc à voir un « ovni », je n’ai pas été déçu ! Comme « Oncle Boonme », ce film est un songe. On abandonne très vite l’espoir de distinguer une certaine réalité de la partie onirique. C’est poétique, sensuel, voire grivois. On n’hésite pas à nous parler et nous montrer tout les fluides corporels ... . Mais ces détails triviaux se mêlent aux croyances ancestrales, à l’animisme et divaguent entre rêves et réalité. Puisque très vite on abandonne l’idée de comprendre un plan grâce au suivant, chaque scène est appréciée pour ce qu‘elle est. Rien de plus. Chaque image, parfois surprenante, paraît donc habitée et semble dévoiler un monde invisible.
La Isla mínima, 4.0, En voilà un film qu'il est bien fait ! Le seul défaut a mon goût étant la photo, le reste est incroyablement efficace. Quand, dans le genre, l'habitude veut que tout s'éclaircisse au fur et à mesure du déroulé du scénario, cette fois, tout s'intensifie, prend de l'épaisseur. Les personnages prennent de la complexité en même temps que l'intrigue si bien "ficelée". Même le dénouement, s'il n'est pas ébouriffant de surprise laisse un goût amer de frustration ... Bien joué !!
Difret, 3.0, Les faits de « Difret » (audace) se déroulent en 1996 dans la toute jeune république fédérale démocratique d'Éthiopie qui s’est dotée d’une constitution quelques mois auparavant. Nous sommes donc dans une société en totale mutation, où le droit des femmes et des enfants est encore un territoire à défricher. Cet aspect primordial des choses n’est hélas même pas effleuré. Après la brutalité pure des premiers instants, on comprend tout de suite qu’une avocate bénévole s’investit dans un combat perdu d’avance. Mais puisque le scénario est inspiré de faits réels, pas besoin d’être grand augure pour deviner l’issue du combat judiciaire !!La liste des films hagiographiques sur les grands militants est longue, comme celles sur les causes (que l’on croyait) perdue, celui-ci n’est pas le meilleur.L’histoire de Meaza Ashenafi est une vraie chronique du militantisme post-révolutionnaire éthiopien, mais il méritait un meilleur traitement. Reste une froide description de la justice coutumière avec son train d’archaïsmes dans une belle campagne éthiopienne avec godjo, teff et injera … ça change !
Comme Un Avion, 3.5, Le thème du film … Laetitia l’explicite très bien ; Michel, héros du film, se laisse porter par le temps, par les événements, se laisse porter par le courant.Car le film est un essai sur le mouvement, non sur son ampleur mais sa qualité. Michel est un graphiste tranquillement installé dans sa cinquantaine laborieuse bourgeoise et parisienne. Misanthrope et rêveur, il s’imagine bien voler pour l’aéropostale, transporter des colis dans les hautes vallées de la Cordillère des Andes, relier les hommes aux hommes. Donc, il porte un blouson Mermoz mais n’a pas une heure de vol … de toute façon il ne veut pas voler !Voilà en 25 minutes, le décor est planté, ou plutôt les personnages installés. Un patron/frère un peu trop sérieux, une femme délicieuse à peine trop compatissante. (comme Sandrine Kimberlain joue bien ce rôle attachant !)Et parce que son épouse le défie quelque peu, Michel fini par passer du rêve à la réalité, pour la première fois à priori. S’en suit une fable poético-burlesque au fil de la rivière. Aux délicieuses situations incongrues succèdent des errements improbables et cocasses. Tout mène au sourire, au plaisir ; les paysages ravissants, le bonheur évident des acteurs, l’obsession de Michel pour le matériel adéquat, l’usage inédit des Post-it par Laetitia et même la colère déroutante contre tous les kayakistes d’un pêcheur irascible campé par Pierre Arditi.Un délice d'écriture ou l'humour fuse en pétard à tout moment.
Mustang, 4.5, Voilà une fresque adolescente magnifiquement traitée. Ici se percutent avec pertinence la gravité des traditions sociales et la légèreté de l’adolescence. Le film réussi la performance de nous faire comprendre la lourdeur des coutumes vues par le prisme évanescent de l’enfance qui s’évanouit. L’élégance du propos réside dans l’absence totale de manichéisme et la présence de saillies humoristiques qui viennent alléger le récit toujours fort à propos. Un vent de liberté inévitable souffle sur cette œuvre onirique ; une vraie réussite !
Taxi Téhéran, 2.0, Ce film m’a laissé l’impression mitigée d’un témoignage sur Téhéran à travers un petit trou de serrure. J’aime que les choses sont clairement établies et j’ai détesté passer mon temps a démêler le vrai du faux. Bien sûr, j’aurais pu me documenter, apprendre comment avait été fait ce film, qui était Panahi … oui mais j’aime bien être surpris et garder ma fraicheur de jugement. Et voilà que ce documentaire à sketches tourne à la farce spoiler: quand un vieillard plein de ketchup fait irruption dans le véhicule avec sa « future » veuve déjà éplorée … Alors, on comprend vite que tout est bidon, éventuellement que l’on nous a pris pour des quiches depuis le début et que le discours, à l’inverse d’un « radio trottoir/taxi » est partial et orienté. Reste une dénonciation courageuse des interdits de toutes sortes montrés avec une expression douteuse.Sans moyen (et pour cause) ce n’est pas une œuvre artistique, sans sincérité, c’est un mauvais témoignage … pendant lequel, d’ailleurs, on n’apprend pas grand-chose !
Timbuktu, 2.5, Le parti pris de la fable poétique pour décrire le bouleversement que représente l’invasion intégriste était osé … et le résultat est mitigé !Le fascisme qui consiste à imposer des règles de vie à des populations est abordé maladroitement. Les difficultés de communication entre langues Bambara, arabe, française et Tamasheq sont elles très bien décrites. Il y a autant de scènes fantastiques que d’autres inexplicables, voire hors contexte. Il reste donc un sentiment amer de perplexité face à ce drame humain.
American Sniper, 1.5, Clint Eastwood vieilli mal ! La pensée binaire à l’état pur ! La géopolitique du Moyen-Orient pour les nuls ! En même temps, n’est-ce pas la psychologie de ce personnage ? Un homme inculte, fils de rustaud texan, élevé à l’aulne du patriotisme réducteur et de la religion monobloc assénée avec force à la table familiale ! Une fois sur le terrain, il s’acquitte de sa tâche biblique et vengeresse en tirant sur la masse indistincte de guérilleros orientaux, mal rasés et fourbes. Rien n’est jamais remis dans son contexte (aucune mention de Bush, de Saddam Hussein ou des racines erronées du conflit). Les peuples autochtones ne sont brossés que grossièrement et décrits comme des sauvages. A croire qu’ Eastwood restaure même, une vision du monde que l’on croyait enterrée avec la disparition de la politique des faucons à la Maison Blanche autour de Bush, Condoleezza Rice et consorts.Si le film veut retracer la vision simpliste du monde par un benêt décérébré … c’est gagné !
Le Dernier Loup, 0.5, Le défi est de rédiger une critique cinématographique totalement négative de ce spectacle affligeant sans se joindre aux sempiternelles lamentations larmoyantes des défenseurs des animaux. Parce que, rien ne nous est épargné dans ce film. Déjà, avec « Or noir », nous avions eu droit à une ribambelle d’anachronismes dramatiques (genre bédouin à la prière dos à La Mecque) et là, on atteint des sommets. Jean-Jacques Annaud semble ne porter aucune attention à la crédibilité du récit. C’est techniquement très abouti, les scènes nocturnes de troupeaux tournées de nuit avec des drones, par exemple. Mais pour le reste … cela respire un dilettantisme coupable. La liste serait longue des scènes dramatiques qui portent à sourire ; une morsure au bras qui fait jaillir le sang comme d’un ballon de baudruche, des chevaux en plastique kitchissime figés dans la glace, du givre en sucre glace sur des moustaches mais pas la barbe, les bruitages suggestifs des os qui se brisent dans un fracas d’enfer etc.La bergère, jouée par Ankhnyam Ragchaa, évolue dans un environnement plus que rustique, mais elle est toujours bien coiffée, quelques mèches rebelles bien étudiées, les mains manucurées, les ongles brillants, jamais noirs … Dans ce milieu d’éleveur, jamais aucun d’entre eux n’est sale … Le monde des bisounours en fait !Coté musique, James Horner nous gratifie d’envolées lyriques de violons et de grands coup de cymbales qui manquent furieusement de finesse.L’impression générale donne une niaiserie éventuellement crédible pour des enfants... renforcée par une scène finale totalement affligeante !
Phoenix, 2.5, Tout est très très convenu, cela rend le récit quasiment ennuyeux. Les juifs sont riches, les nazis des imbéciles, les victimes torturées psychologiquement, les lâches le restent ...On a tout compris dès la moitié du film, c'est vraiment surprise.Mais c'est très bien ficelé, magnifiquement joué ...
Hippocrate, 3.0, Les arbitrages et les compromissions du milieu hospitalier sont bien traités. Les cas de conscience de cet interne ne m'ont, par contre, pas spécialement ému. Le rapport au père est bâclé. Le personnage du FFI est par contre très intéressant. Jusqu'où peut-on être intègre ? Bonne question !
Edge Of Tomorrow, 3.5, Le ressort humoristique est évidemment déjà vu dans "un jour sans fin", la construction, l'intrigue et le visuel sont ceux d'un jeu vidéo... "essaye encore" ... :-)On comprends donc très vite qu'avec un nombre de vies illimité, le héros va parvenir à ses fins, le suspens en pâti énormément.Mais, qu'est-ce que c'est bien fait !! C'est magnifique, un spectacle total !
Dallas Buyers Club, 4.0, Film pudique et léger sur un sujet tellement grave ... toutes ces récompenses sont méritées. On évite le glauque, le pathos et l'humour est souvent là pour lever le couvercle de la lourdeur ambiante ...Si la "conversion" de ce cow-boys dépravé en chantre et surtout militant de la vie saine avait un peu mieux traité, on frisait le chef d'oeuvre !!
Sur Le Chemin De L'école, 3.5, Un petit bonbon de candeur et d'innocence pour traiter d'un sujet important sinon grave ... Aucun commentaire d'adulte ne vient perturber le propos des enfants. Un bémol sur les saynètes qui viennent compléter le cheminement et qui parfois sont malhabiles ... mais, ce ne sont pas des acteurs, donc nous seront indulgents. L'espoir laissé par les rêves d'enfants dans les dernières minutes est une pur moment de sérénité.
Prisoners, 4.5, Prisoners nous montre les cotés les plus sombres de l'âme humaine quand l'inenvisageable survient : le rapt d'enfant. Si dans le fantastique "Incendies", Denis Villeneuve avait aussi signé le scénario, ce n'est pas le cas cette fois, mais la construction de celui-ci nous tient en haleine de début à la fin. Y sont décrit de façon implacable la tension des familles, un père désespéré prêt au pire, l'autre famille ébahie, paralysée par sa douleur et le flic impavide tourmenté par la complexité de l'enquête. Jake Gyllenhaal, magnifique (que je n'avais pas revu depuis Broke back montain) campe un policier qui se tient a distance d'un père qu'il soupçonne vite de détruire par sa vindicte ce qu'il cherche à découvrir... Villeneuve, se frotte à un genre où souvent les personnages sont, soit caricaturaux, soit déshumanisés. Il parvient ici, en évitant le larmoyant, à nous tenir en équilibre entre le bien et le mal, l'acceptable et l'intolérable, parce que chaque personnage a son coté sombre et son coté attachant. Dés le générique, la prière incantatoire nous assène la faiblesse de l'homme ... c'est ce coté très bigot anglo-saxon que je n'ai pas aimé. Reste une peinture magnifique et sensible de la violence injustifiable engendrée par le stress intense, la descente aux enfers de parents terrassés de douleurs mises en face de leurs pulsions primaires quand la mort rôde.
Blue Jasmine, 0.5, Au secours ! Au secours !Le portrait d'une personnalité exaspérante par son snobisme et sa mythomanie, confrontée "au bas peuple" aurait pu être un ressort comique intéressant ... Le film est juste aussi exaspérant que l'héroïne ... et pas drôle du tout !!
Alabama Monroe, 3.5, Une lumière et un ton inhabituel confèrent à ce film un particularisme très séduisant. La première partie rappelle furieusement "La guerre est déclarée" mais ici avec beaucoup plus de finesse et d'émotion, grâce à la place faite à la musique bluegrass. On est balloté entre humour et profondeur, entre légèreté et drame à travers des descriptions très pertinentes d'émotions violentes.Des scènes d'anthologie de "pétage de plombs" de la part des deux principaux protagonistes servent un traitement émouvant du deuil.
Frances Ha, 0.5, C'est peut-être un film "pour fille" ... je ne sais pas ... Je n'ai vu aucun intérêt à ce récit bavard. Comme je ne vois pas ce qu'apporte le noir et blanc ... Ce qui est super c'est qu'il faisait frais dans la salle ... et à Aix, ça "tapait" cet après-midi !
L'Attentat, 4.0, Une belle subtilité pour nous conter le conflit entre juifs et arabes dans les differentes parties d'Israël. Un regard autre, de la légèreté pour nous montrer la lourdeur de plomb de ce conflit qui s'éternise.Un film prenant, captivant ...
Gatsby le Magnifique, 4.0, C'est un délire total ! De ce fait le parti-pris de traiter le sujet sur le mode débridé de la BD est parfaitement cohérent. Les décors sont époustouflants, les acteurs émouvants à souhait !La description de ces années effrénées est une grande réussite, l'histoire d'amour irréaliste parfaitement maîtrisée. Certains trouvent le film un peu long, moi j'en aurais bien repris !!Par contre, la 3D m'a plutôt fait mal à la tête qu'autre chose ...
Le Passé, 4.0, Asghar Farhadi est un orfèvre ... C'est, comme dans la "Séparation" SON scénario qu'il réalise lui-même. Cela donne une merveilleuse cohérence entre le récit et la manière de le délivrer ! Ce petits faits en détails insignifiants, il construit un drame qui nous surprend toujours. Après une mise en place relativement "longuette", il nous tient en haleine jusqu'au denouement auquel on s'attend pas , bien évidemment ! C'est une mécanique implacable dont on ne voit pas les rouages. Tout parait anodin mais tout est signifiant. Une horlogerie magnifique !!
20 ans d'écart, 3.5, Une vraie bonne comédie de moeurs, un Charles Berling épatant et Virginie Efira resplendissante et sensible. A mon avis, elle ne fait assez âgée pour le rôle ... et du coup, les 20 ans d'écart ne se voient guère !Bémol ; la dernière scène de l'amphi est grotesque.
The Place Beyond the Pines, 0.5, Trois films pour le prix d'un ... mais cela reste trop cher ! Marre des sempiternels remords inspirés de notre culture judéo-chrétienne, marre de nous voir asséner toujours les mêmes poncifs ...- les mauvais s'en sortent toujours quand ils sont "bien nés" ...- les exclus n'ont aucune chance- les mauvaises actions nous rattrapent toujoursDepuis "la couleur des sentiments", il ne nous avaient été donné d'être ainsi confronté à ce que le cinéma américain peur faire de pire !Aucune surprise de scénario, tout est prévisible, aucun lieu commun ne nous est épargné ... C'est d'un ennui !!!
