Title,Rating,Review
Le Grand Bain, 1.5, De façon liminaire, il faut préciser que la natation synchronisée ne sort pas grandie de ce film. On suit donc une troupe improbable et hétéroclite de divers déprimés, ratés et handicapés légers. Ils s’entraiment sous la houlette d’une ancienne championne devenue alcoolique qui leur fait la lecture lénifiante d’une littérature de développement personnel, pendant les entrainements. Voilà comment la première heure roborative se déroule … lentement. C’est alors que le gentil idiot (magnifique Philippe Katerine) décide ses collègues quadragénaires et quinquagénaires bedonnants à participer aux championnats du monde… on se demande encore comment ! Et c’est aussi à ce moment qu’entre en scène Leila Bekhti, absolument convaincante en entraineure autoritaire à la trique facile ! Trop forte cette entraineure qui roule en fauteuil roulant dans les galets et le sable mou d’un lit de rivière !! Le film bascule alors dans le grotesque, c’est ce qui pouvait lui arriver de mieux, et ainsi permettre quelques traits d’humour. Et comme Lellouche ne fait pas dans la dentelle, on a droit ensuite à un remake de Full Monty à la française. Mais si les Chippendales de Full Monty obtenaient un succès de quartier,spoiler:  cette bande de branquignoles grassouillets va, elle, devenir championne du monde !! Rien que ça ! Voilà, une ode à la lourdeur !
BlacKkKlansman - J'ai infiltré le Ku Klux Klan, 3.0, Spike Lee s'est laissé aller dans les clichés dirimants à la véracité du propos ! Si les racistes étaient tous des caricatures de gros c...ns alcooliques, ce serait trop simple ! La reconstitution des années 70 est à peine effleurée. Reste une maîtrise parfaite de la mise en scène, des dialogues percutants et une belle photo... mais quand on veut faire un film militant, c'est un peu léger.
Le Poirier sauvage, 3.0, 3 étoiles parce que j'hésite entre 4 et 1 ! Il y a dans ce récit d'une vie ordinaire en Turquie, des fulgurances extraordinaires et des longueurs récitatrices insupportables. Pendant 3 heures, nous suivons les échecs scolaires, les échecs professionnels, les échec familiaux, les échecs sentimentaux d'un jeune homme en Anatolie. Bref on ne rigole pas ... quoique parfois ! Des bavardages aussi intéressants que peu cinématographiques sur la caste des écrivains, sur le libre-arbitre et la religion ... qui sont d'une longueur fastidieuse !
The Guilty, 3.5, Un exercice de style magnifiquement maitrisé ! Un seul acteur visible (ou presque) , un seul bureau pour servir de décor ... Tout le récit est porté par la bande son superbement élaborée. Ce qui valide définitivement l'impériosité de voir ce film en VO. C'est presque une émission de radio ! Les protagonistes - visibles ou pas - ne se dévoilent au téléphone que par petites touches aussi fugaces que pertinentes. Les dialogues, tantôt acerbes, tantôt tendres sont d'une acuité redoutable. Une réussite totale avec les réserves liées à ... un exercice de style !
Les Bonnes Manières, 4.0, Et pourtant, je n'apprécie guère les films d'horreur/surnaturel ...En fait je ne connaissais pas à l’avance cet aspect du film. Et justement, le film est une perpétuelle invitation à réviser ses attentes et à s’échapper du sens commun. Tous les rebondissements nous surprennent ! Dans un décor et une histoire banale et coutumière – ou presque – le surnaturel apparait insidieusement au long d’accumulations de situations choquantes. La quotidienneté du récit met en relief ces indices troublants de la survenance de faits extraordinaires. Reste les fortes questions posées par le récit : quelles sont les motivations pour élever, protéger un « monstre » ? Jusqu’où mène l’amour ?
La Forme de l'eau - The Shape of Water, 4.0, Guillermo Del Toro a déclaré dans une entrevue : « Les premiers conteurs, assis autour d’un feu de camp essayaient de trouver un sens au monde. Ils avaient besoin de créer des anges et des démons, de la beauté et des monstres. » Le film n’a aucune autre ambition. Toutes les critiques reprochant au film un message primaire, un propos naïf à l’excès, un décor de pacotille, des émotions puériles … ont raison ! Et c’est pour cela que c’est charmant. Une certaine régression intellectuelle – comme quand on va voir un « pixar » - est absolument nécessaire pour se laisser bercer par cette fable onirique. C’est une délicieuse allégorie humaniste avec la bienveillance et la tolérance comme figures de proue. Comme c’est extrêmement bien fait, que c’est écrit avec précision, il est facile de se laisser emporter par les symboles puissants et contrastés … et par le charme incontestable de Sally Hawkins.
Call Me By Your Name, 4.0, Le nord de l’Italie, pendant l’été 1983 sert de décor délicieux à cette chronique amoureuse. Le fabuleux Timothée Chalamet l’habite avec délectation. Je n’ai pas mis 5 étoiles parce que je me suis ennuyé ferme lors de la première partie du film qui sert de mise en place. La description de cette famille aussi extraordinaire qu’improbable dans cette langueur estivale est quelque peu monotone. Puis l’habileté de l’écriture de James Ivory et la dextérité de Guadagnino deviennent incroyablement convaincantes. La finesse des joutes verbales entre Oliver le stagiaire américain, éphèbe caricatural et Elio l’adolescent surdoué en quête d’identité sexuelle est délicieuse. Le récit est allégé des atermoiements et autres lourdeurs existentielles qui émaillent trop souvent les chroniques adolescentes. Le ton est décomplexé, frontal mais sans vulgarité ni provocations. Le film est porté par une indolence qui ne se laisse jamais écraser par la paresse, il irradie d’une beauté pure et sans efforts, dont la simplicité même est la source d’une multitude d’émotions.La finesse de l’écriture de J.Ivory retranscrit sans fausse pudeur tous les détails et les vicissitudes de cette histoire d’amour en évitant les écueils inhérents à l’exercice. Le regard du réalisateur sur ses personnages est identique à celui que ceux-ci partagent : empathique, bienveillant, complice et plein de séduction. Le père d’Elio, incarné par le discret Michael Stuhbarg, nous offre une des plus belles scène du film : un monologue plein de tendresse, lucide et réconfortant. Tous les pères sentiront des monceaux d’émotion monter en eux !! La fin du film, en rupture de ton avec la douceur de l’été, nous fait prendre conscience de la solidité et la fugacité du moment qui vient de passer
3 Billboards, Les Panneaux de la vengeance, 0.5, Une peinture débilitante de l’Amérique des « petits blancs » pour les nuls. Tous les personnages sont caricaturaux et le piège de l’outrance se referme peu à peu pour annihiler toute vraisemblance à un scénario indigent. La critique de la petite société provinciale américaine à déjà tellement été dépeinte – souvent avec talent - qu'ici le manque d’épaisseur de la mère de famille rebelle, du policier raciste bas de plafond et autres protagonistes handicapés du raisonnement pousse à sourire. Seul le responsable de la police locale tient des propos cohérents … mais il est en phase terminale de cancer et disparait trop vite. Bref, une médiocre description de la médiocrité.
Makala, 4.0, Un homme frêle et armé d’une simple hache, s’attaque à un arbre gigantesque. C’est la première image du film et pourrait servir de parabole au message qu’il délivre. Kabwita, c’est son nom, doit faire face à des défis incommensurables. On découvre petit à petit le dénuement absolu, de sa famille, l’insécurité émouvante de sa condition et tout ceci dans une pudeur souveraine. Du pur tragique de situation ! Kabwita coupe son arbre, fait le charbon de bois (makala), le charge sur son vélo et va le livrer … à 50 kilomètres … à pied ! Une telle vulnérabilité rend l’épopée totalement poignante ! La caméra suit ce héro modeste au plus près lors de ce road-movie époustouflant. Une économie de moyen, une sobriété de démonstration, une bande son pertinente et la photo magnifique donnent toute sa force a ce docu-fiction.Kabwita rendu à la ville, charbon de bois vendu, va se confronter au coût de ses rêves … Seule la foi semble lui permettre d’accepter sa situation et cela donne lieu à une scène finale poignanteSi il y a encore quelques esprits étroits qui se demandent pourquoi des africains traversent comme ils peuvent la Méditerranée pour nous "envahir", ce document est une réponse magistrale.
Seule sur la plage la nuit, 4.0, L’actrice principale, Min-Hee Kim, fascinante et captivante, magnifique et magnétique, nous fait part de son mal-être à travers une amie à Hambourg où elle attend la venue hypothétique de son amant. De retour en Corée, au détour de promenades, de rencontres, de discussions et autres repas plus ou moins arrosés, nous est distillée à très petite dose la réalité de la situation de cette actrice en désamour. L’absence devient peu à peu le voile duquel se nimbe cette actrice en rupture. Cette absence prend la forme d’une fuite de la réalité, où sourdent solitude et opprobre. A la lecture primaire, voire banale de la colère d’une femme abandonnée, s’ajoute la mélancolie, l’incertitude. Du plus anodin, le réalisateur nous amène avec une extrême délicatesse vers les plus rugueux sentiments humains. L’affliction de cette femme, ses sentiments post-ruptures sont abordés avec une rare délicatesse. Son inconscient l’accompagne tout au long du film sous la forme d’une silhouette d’homme accomplissant les tâches les plus incongrues donnant des respirations désopilantes ! La bande son, habitée essentiellement par Schubert, vient merveilleusement souligner les variations d’humeur de l’héroïne.Par contre, les zooms et les travelings sont faits à la serpe et desservent énormément la tenue qualitative de l’ensemble.
L'Echappée belle, 2.0, Quand on ne veut pas décrire la vacuité du quotidien d’un couple de personnes âgées, on fait un road-movie pour bien tout condenser ! Après il suffit d’imaginer une vieille femme avoir assez d’audace pour emmener son vieil époux sénile au volant d’un camping-car pourri sur des milliers de kilomètres de nostalgie. Mais quel beau spectacle que de voir une femme en phase terminale de cancer aussi sémillante accompagnée d’un homme sénile aussi élégant, vif et attendrissant ! Pour parfaire la véracité du récit, le couple cacochyme regarde les diapos de leur vie commune sur un drap suspendu aux arbres du terrain de camping ! Pendant ce temps-là, les deux enfants pataugent dans leur paradigme caricatural, genre l’un totalement stressé, l’autre dans le laissez faire.Pendant le voyage on nous suggère aux détours de quelques scènes amusantes que la culture se perd au travers d’une jeunesse décérébrée et abrutie qui vote Trump. Au moins c’est simple ! Simpliste ?Certes, nul n’est obligé d’exiger que la vieillesse soit toujours traitée de façon sérieuse et sinistre mais de là à la décrire à travers les yeux de Forest Gump …Sinon, une très belle performance d’acteur qui compense le scénario famélique. Alors, on rit et on pleure parce que si la mise en scène est pachydermique, elle est efficace.
Coco, 3.5, Faire un film d'animation - pour les enfants donc - sur la mort, l'oubli et le culte des ancêtres ... fallait oser ! Le pari est partiellement réussi, mais grâce à des recettes déjà vues chez Pixar, voire Disney. Comme d'habitude, c'est superbement bien fait, le rythme est haletant (trop ?) et les recettes fonctionnent pour nous émouvoir. Un bon divertissement sans surprise ...
Le Brio, 3.5, C'est drôle, émouvant et très bien ficelé. Peut-être un peu facile ? Certains clichés auraient pu être évités … La difficulté à rester soi-même quand la vie vous oblige à changer de milieu social et culturel est bien abordée mais pas assez prégnante dans le scénario … Daniel Auteuil est magnifique …
Prendre le Large, 3.0, Film sans concession ... sans concession à l'esthétisme, sans concession pour le monde du travail, sans concession pour un Maroc que l'on a du mal a imaginé autrement que touristique. Une femme désespérée, esseulée par son orgueil et son intransigeance va tenter sa chance "ailleurs" ... au Maroc en l'occurrence. Elle va finir par apprécier une vie sans grand intérêt, par apprécier les gens qui l'entourent ... Je me demande pourquoi d'ailleurs ... Cela n'est pas plus attrayant que cela de voir la moue boudeuse de Sandrine Bonnaire pendant tout le film.
Braguino, 4.0, Totalement déstabilisant ! Deux familles se haïssent au milieu de nulle-part ... Comme un réflexe chevillé au corps ! Ce moyen métrage pose la question de savoir quels sont les dégâts causés par l'isolement ? par le manque de norme ? N'être soumis à aucune norme rend-il les gens détraqués ? Détraqués selon quelles normes ? Il n'y a que les enfants qui semblent "adaptés" !! C'est absolument vertigineux ...
Au Revoir Là-haut, 3.5, A force d'exigence, la recherche de la perfection de l'image - voire du son - frise l'exercice de style. Tout est bien fait c'est évident. Dupontel s'est entouré d'une pléiade d'acteurs de talents et de ce fait, la faiblesse de son interprétation est mis en évidence ! Et puis, il y a la fin !! Mais quel gâchis !!
Detroit, 4.0, Un film militant a la virtuosité évidente. Peut-être est-ce pour faire écho aux assassinats de Trayvon Martin ou Michael Brown que la réalisatrice a voulu sortir la société américaine d’une amnésie coupable. Cela débute par un résumé historique – genre histoire des USA « pour les nuls » - pour enclencher très vite sur une description au scalpel des émeutes à Détroit en 1967. Servi par des archives pertinentes nous sommes plongés dans l’incertitude puis la peur étouffante de l’arbitraire des oppressés chassés par les oppresseurs. La deuxième partie est encore plus grandiose ! Un huis clos hallucinant entre victimes innocentes et bourreaux. L’universalité du discours illustre tous les conflits où la bestialité des dominants est force de loi. A ce moment du récit, je savais que j’étais face à un chef-d’œuvre ! Hélas, il y a une 3ème partie ! Une partie « tribunal » parce que les américains adorent ça, avec son cortège de « objection votre honneur », de « objection rejetée », d’effets de manche des avocats … On en attend rien et nous ne sommes pas déçu ! Mais c’est insuffisant ! Il y a aussi une 4ème partie ! Le salut de l’âme en se tournant vers la religion … catholique, évidement ! C'est très américain et donc aussi obligatoire que pénible. Jusqu’à la fin de la deuxième partie, le film est époustouflant et permet de véhiculer un message – certes universel – da façon extrêmement pertinente. Et puis, ces deux mauvaises dernières parties montrent alors le film plus qu’un moyen honorable, devient une fin en soi … Dommage, à 25 minutes près, c’était un chef-d’œuvre !
Un Beau Soleil Intérieur, 1.0, Donc, le personnage de J.Binoche pense trouver des réponses a son mal d'amour en couchant avec n'importe qui ... Voilà, voilà ... Et les "n'importe qui" n'ont que très peu d'intérêt. Et puis, à un quart d'heure de la fin, Depardieu offre à Binoche un dialogue surréaliste (impro ?) absolument hilarant ! Alors, ne vous embêtez pas avec la première heure, allez voir juste la fin !
Faute d'amour, 0.5, La première heure est une mise en place, une description terrifiante des protagonistes. Pas un pour racheter l’autre ! Un père insignifiant et veule se « castagne » verbalement avec son épouse dont il divorce. Il a mis enceinte sa maitresse paranoïaque. La mère haineuse et adultère déteste tout le monde et voue une colère sans limite à son mari infidèle. Aucun échange possible, une caricature de négation du dialogue. Un enfant (que l’on voit peu) est en train de sombrer au milieu de cette ambiance délétère où aucun des deux parents ne veut s’occuper de ce garçon ! Bref, une galerie de portraits monstrueux qui donne la nausée. Durant la deuxième heure, on suit sans passion le recherche du garçon qui a fugué. Cela permet de compléter la galerie par le portrait de la grand-mère maternelle, un mix de Folcoche et de Staline, et d’un policier cynique débordé et inefficace ! Voilà, deux parties distinctes ; la première où l’on s’ennuie et la deuxième est pire ! L’impression d’avoir été puni pour avoir osé entrer voir ce film.
Wind River, 4.5, Un western où les chevaux laissent place aux « skidoo », un polar où l’intrigue est moins importante que le décor, une confrontation entre des sauvages et des civilisateurs … mais qui est qui ?Ces ingrédients sont savamment dosés et la mayonnaise prend très bien. J’ai été happé du début à la fin ! Le spectateur découvre peu à peu les drames intimes des différents protagonistes qui viennent étoffer le récit. Taylor Shéridan aurait fait un patient travail de documentaliste auprès des indiens qui ont été concertés pour le scénario. Car le but du film est de nous présenter, au milieu de la blancheur immaculée des montagnes du Wyoming, la noirceur d’une société amérindienne en déliquescence où la jeunesse ne semble n’avoir comme choix que la fuite ou le renoncement. Les superbes images de montagnes, aussi prégnantes qu’inquiétantes apportent un souffle lyrique et guerrier.Jérémy Renner brille ici par l’incarnation de la fragilité de celui qui a accepté de vivre avec sa souffrance.
Gabriel et la montagne, 4.5, Toutes les interrogations que posent le voyage sont évoquées dans ce road-movie qui se déroule en Afrique. A partir longtemps, prend on le risque de se perdre ? Sans identifier les raisons du départ, trouve-t-on des raisons de revenir ? Le personnage principal est envoutant, plein d’énergie, parfois tellement qu’il en est exaspérant. Son insouciance et son imprudence force le respect parce qu’ils sont nécessaires a l’accomplissement de ses rêves d’aventure. L’ivresse de ses pérégrinations nous gagne peu à peu et on finit par l’envier même en connaissant le dénouement funeste dès le début du film. Et c’est là une belle idée du tuer dans l’œuf toute forme de suspens, ce qui permet de transformer le spectateur en voyageur errant aux cotés de ce routard enthousiaste. Un souffle supplémentaire de spiritualité aurait fait –pour moi – de ce très bon film un vrai chef-d’œuvre.
120 battements Par Minute, 2.5, La description des débuts de Act’Up – validée par certain de ses anciens membres – est incroyablement crédible d’humanité, de démocratie directe exaspérante, de contradictions. L’ambiance festive de ces années-là est plus édulcorée et carrément trop sage. (mais une magnifique allégorie de la poussière soulevée par les danseurs laissant penser au virus qui se répand sur ces jeunes gens qui s’amusent …) Cette partie quasiment documentaire est plus intéressante qu’émouvante. Et quand les scènes redondantes se multiplient, les interventions musclées, les réunions houleuses et interminables, le film dérive sur l’histoire d’amour du protagoniste principal. C’est joli, romantique, sobre, pudique même, et ennuyeux à souhait. Le personnage de Nathan est insipide et transparent. Tout cela se termine dans un pathos nauséeux avec une veillée du corps du défunt qui est interminable …
Le Caire Confidentiel, 4.0, Une description implacable de ce qu'est la corruption à tous les étages des services de police - en Egypte en plein chaos de 2011 en l'occurrence. Ce vertige de ne pouvoir se fier à qui que ce soit, cette insécurité permanente de n'avoir plus aucune référence à ce que devrait être la justice ... Un policier corrompu mais avec des principes, un témoin immigré qui ne sait pas lire l'arabe, un potentat député, un cacique de la police uniquement intéressé par la meilleure répartition des détournements ... personne n'est épargné par le seul désir de sauvé sa peau au milieu de cette fange de déni de justice ! C'est vertigineux !!
Que Dios Nos Perdone, 4.0, Deux ans après "la isla minima", le cinéma espagnol nous délivre un thriller magnifique ancré dans la situation sociale d'un pays. Les personnages semblent d'abord être des caricatures et l'on découvre peu à peu toute leur complexité. Les faux-semblants sont battus en brèche par des oppositions bien mesurées entre le sacré et le profane, la pureté et la corruption, la probité et la malhonnêteté. Le malaise des flics, leur tâche ardue et ingrate est superbement illustrées. Les démons n’ont pas la tête que l’on imagine, les anges ne sont pas où on les attends …
Les Filles d'Avril, 2.0, Ce film est un habile étalage de toutes sortes de psychopathologie et autres névroses ! Une femme quadragénaire autoritaire, manipulatrice, en mal de maternité et mère de deux filles. L’ainée est dépressive, mal dans sa peau et en surcharge pondérale, la cadette de 17 ans est hystérique et incapable d’assumer sa grossesse hâtive à 17 ans. Le père de l’enfant, 17 ans lui aussi est insignifiant et immature. Il n’est pas aidé par des parents non-concernés et autocentrés sur leurs occupations. Reste le père absent de la jeune mère qui n’en a rien « secouer » ! En voilà une belle brochette de névrosés !! Ne doutons pas que la réalité, non moins prodigue que la fiction en histoires tordues, ne recèle des cas semblables. La froideur implacable avec laquelle le réalisateur met ses personnage en scène, ne leur laisse aucune chance … tous tant qu’ils sont étant affligés d’une tare mentale qui semble congénitale ou héréditaire. Déprimant tableau clinique sauvé par le talent de séduction hystérique d’Emma Suarez.
Dunkerque, 3.0, Une note moyenne car il est difficile de faire fi des anachronismes historiques grotesques, surtout dans la première partie du film. Aucun effort de véracité n'a même été tenté. La caméra se déplace dans un Dunkerque des années soixante, les barres HLM des années soixante-dix servent de toile de fond à la présentation de la plage proprette à souhait. Les navires de guerre sont quasiment actuels, les avions de chasse allemands sont même "joués" par des corsairs !! Une fois l'effort effectué de se contre-foutre royalement des vérités historiques, le récit qui nous délivre le portrait croisé de quelques personnages en situations exceptionnelles est assez bien brossés ... Mais bon, cela a déjà été fait. Le problème essentiel réside dans le titre ; DUNKERQUE ! Parce que ce qui s'est passé à Dunkerque est à peine effleuré.
Ce Qui Nous Lie, 4.0, C’est un petit peu facile, parfois même racoleur, mais qu’est-ce que c’est bien fait ! Tout est extrêmement bien dosé ; une intrigue financière sert de trame pour nous tenir en haleine sans prendre le pas sur le récit familial, un peu d’infortune matrimoniale, un peu d’exotisme (australien), un peu de conflits confraternels … Mais, il reste le plus important, la Bourgogne, la vigne, le patrimoine ! L’attractivité de ces trois éléments ou le fardeau qu’ils représentent pour les trois frères et sœurs. C’est palpitant, émouvant et parsemé de traits d’humours dévastateurs !
Ava, 5.0, Quel régal ! D’abord, un régal pour les yeux, l’esthétique de la photo est irréprochable, il y a des véritables moments de grâce visuelle, une façon merveilleuse de filmer les corps de femme. Mais il y a d’abord un récit touchant porté par des personnages attachants avec leurs atouts, avec leurs défauts. La première partie est une habile tranche de vie d’une adolescente flanquée d’une mère frivole avec une station balnéaire du sud-ouest comme décor. Et puis le film devient un road-movie, une fuite adolescente … c’est juste, c’est touchant, c’est poignant et même haletant ! Noée Abita éclaire ce film de sa présence magnétique avec l’impudence et la sincérité de ses dix-huit ans ! Elle est magnifique de talent !
Creepy, 4.0, Je n'avais pas aimé "vers l'autre rive", c'est dire que suis allé voir ce film sans grand enthousiasme. Ce fût une très belle surprise. Une ambiance glaciale s'installe lentement, inexorablement. Du thriller, on bascule progressivement vers l'horreur, plus psychologique que sanglante. Le scénario est un peu attendu, mais le récit magnifiquement sauvé par des interprètes talentueux. Un joli frisson en ces temps de canicule :-)
