Title,Rating,Review
Le Vénérable W., 4.0, Difficile de juger un film-documentaire. Les ressorts émotionnels ne sont pas les mêmes, mais quand il s’agit de la Birmanie, mes émotions sont à fleur de peau. Surtout après la daube navrante de Besson, on ne peut qu’espérer mieux ! Le propos de Barbet Schroeder, à travers la description de la trajectoire de « W » est de nous montrer les désastres causés par le communautarisme. C’est toute la grandeur de ce document qui ne se cantonne pas au problème un peu médiatisé des Rohingas. Schroeder nous décrit avec pertinence le fondement du discours de ce leader religieux haineux, arrogant, mythomane. Hélas, pour conforter l’ostracisme religieux, le film évite soigneusement d’évoquer l’hégémonie tribale des Bamars sur la nation. Problème identifié par le général Aung San (pourtant Bamar) qui devait faire signer aux accords de Panglong, une autonomie administrative pour les ethnies minoritaires (135 ethnies, environ une centaine de langues) dans les fondements de la nation naissante en 1947 ! C’est dire que le problème ne date pas d’hier ! Dommage que cette base historique ne soit pas évoquée. Car c’est sans doute elle qui conduit Aung San Su Kyi à une certaine compromission sur ce sujet ! Mais le documentaire ne peut pas tout expliquer en moins de 2 heures et se cantonne – c’est peut-être mieux – a la personnalité de W auprès de qui nos « Le P… » passent pour des sœurs de la miséricorde !Reste que l’on aimerait aussi savoir quelle est l’audience exacte de W auprès des birmans bouddhistes. On en sort assommé par ce déferlement de haine véhiculé par un religieux. Cela conforte gravement mon avis négatif sur les manipulations des peuples par les religions.
Rodin, 2.0, J'espérais avoir un regard nouveau sur ce grand artiste, débarrassé de la romanesque et encombrante Camille Claudel, bref, un autre point de vue. Que nenni ! On a droit a un film en pointillé où apparaissent comme des ombres des Hugo, Cézanne, Monnet, ou Clémenceau. Comme une boule de flipper, le scénario butte et rebondi sur l'académisme de l'art, sur la difficulté de créer, sur l'ironie des amours ancillaires, les dangers de la notoriété. Tout est abordé, rien n'est "fouillé" et de ce fait, peu d'émotions ressenties à la vue de ce film ...Par contre, quelle prestation de Vincent Lindon !
Get Out, 0.5, On nous prend pour des débiles ou quoi ?Mais franchement c’est le film le plus pitoyable qu’il m’ait été donné de voir depuis des années ! Aucun poncif éculé du genre ne nous est épargné ! On a droit aux portes qui couinent, aux planchers qui grincent, aux trophées de gibier inquiétants, aux envolées de violons grinçants, aux grands coups de cymbales, et les petites notes de harpes suraiguës aussi ! Je n’avais rien entendu de tel depuis des années ! Et puis, cette multitude de détails navrants comme la collision avec une biche qui ne provoque aucun dégât sur une voiture, du bois qui dégage une fumée ahurissante quand on le fend etc. … Une intrigue famélique déjà vue mille fois, basée sur la comparaison des races dans une Amérique bourgeoise caricaturée à l’extrême. Au bout d’un certain temps, j’ai pris le parti d’en rire … et là, cela devient savoureux même si l’on est loin de « Frankenstein junior » ! Référence que j’assume car le dénouement est quasiment le même. C’est dire si tout ça est nouveau ! Non, vraiment, ce film nous prend pour des débiles mentaux !
Citoyen d'honneur, 4.0, Le ressort du film est cette idée de retour au village, de retour au passé et au néant d’avant la réussite et la gloire, et de heurt brutal avec la réalité de ce néant, et avec tout le folklore assez coloré qui l’accompagne. Les personnages du village, picaresques, ridicules, offrent une succession de scènes cocasses : les discours au centre municipal, l’arbitrage pour un concours de peinture d’une amusante ribambelle de croûtes désolantes etc. C’est surtout l’occasion de dépeindre tous les petits travers provinciaux : en vrac ; l’inculture ridicule, le profit personnel, la cupidité, l’envie, le ressentiment des différents protagonistes jamais caricaturaux. Et petit à petit on apprend aussi les travers de ce prix Nobel revenu de tout, critique acerbe des péquenauds vus son confort bourgeois. On en arrive à être honteux de ricaner, nous aussi. Bref, tout le monde en prend pour son grade, la nature humaine est décryptée férocement, sans concession, sans exagération. Tout est parfaitement équilibré, pertinent. Un vrai régal !
L’autre côté de l’espoir, 4.0, Ce film a un charme fou. C’est inattendu, déroutant, à la fois glacial et chaleureux. C’est le récit de deux trajectoires convergentes qui se joignent au milieu du film. Un immigré clandestin syrien découvre l’accueil nordique en Finlande tandis qu’un représentant, cinquantenaire insignifiant, décide de plaquer sa femme et son travail de VRP en chemise. Les trajets de chacun d’eux sont grinçants et font sourire à la fois. Le traitement est glacial et chirurgical entrecoupé de fulgurances humoristiques toujours inattendues. Ces dernières permettent de supporter la profondeur du message … Une brillante sinistrose !
The Lost City of Z, 4.0, Jamais depuis Aguirre et Fitzcaraldo, le sujet de la jungle primaire envoûtante et dangereuse n’avait été traité avec autant d’acuité. Ce milieu hostile est hissé ici au rang de déité immaitrisable. Par une forme de récit très prosaïque, le réalisateur fait remonter à la surface nos souvenirs de jungle fantasmée dans les littératures de notre enfance. Mais ce n’est pas tout. L’aspect biopic de cet explorateur britannique est traité avec finesse et férocité. De graves sujets comme l’arrogance de la civilisation occidentale, le coût du sacrifice familial, la force de l’orgueil sont magnifiquement narrés. Un vrai grand moment !
Moonlight, 3.5, Quand je pense que certains ont annoncé ce film comme étant la première fiction antidote de l’ère Trump ! C’est quand même très exagéré ! La forme évite soigneusement le film à thèse … tellement bien, qu’au bout de quarante minutes, on se demande où l’on va ! (voire ce que l’on fait là). Puis avec élégance, le film aborde le sujet de la faiblesse, de la sensualité, de la sensibilité dans un milieu où elles n’ont pas droit de cité. Mais la qualité du film est aussi son défaut. A force d’évitement à se laisser cerné, de retenir les énergies tragiques – comme le personnage principal – le récit en perd de la force. Dommage car l’idée est magnifique et décline une œuvre douce-amère de qualité … mais sans éclat !
Tempête de sable, 3.5, Une évocation délicate et pertinente de quelques problèmes encore très largement rependus ; soumission des hommes aux diktats culturels, soumissions des femmes à leur maris, mariages arrangés ! Mais le film évite allégrement le manichéisme avec des personnages principaux que l'on voit évoluer au long du film. Le père qui devient de moins en moins sympathique en même temps que sa première épouse devient de moins en moins docile. La fille ainée cristallise toutes les tensions sur ses épaules. Le jeu des acteur(es) est irréprochable.
L'Ascension, 2.5, Un film plein de bonnes intentions qui poussent à être indulgent. Pour autant, l'ajout d'une romance au récit initial n'apporte absolument rien à l’intérêt de l’histoire. Ahmed Sylla joue sur le même registre du début à la fin, plein de bonne volonté, mais lassant. Les prises de vue népalaises sont assez jolies. La partie himalayisme – au-dessus de 6.00 mètres - a été tournée dans les Alpes … ça se voit ! La difficulté technique et physique de ce milieu est totalement galvaudée et c’est horripilant ! Il en reste une belle histoire assez amusante et presque charmante.
Manchester By the Sea, 0.5, Je suis sidéré de voir à quel point de film est surcoté ! Il y a, à la base une idée digne d’intérêt. Un jeune crétin d’un port sans attrait de la côte atlantique s’est exilé à Boston où il est homme à tout faire … A la mort de son frère ainé, il revient à Manchester et apprend que dans son testament, celui-ci l’a nommé tuteur de Patrick, le fils de seize ans. La découverte à coup de flashback des traumatismes de cette famille est convenue et ne provoque aucune émotion ! Parce que les ficelles sont énormes et parfois même risibles. C’est la première que je ris en voyant des cadavres extirpés des décombres fumants d’une maison brulée ! Cela dit, les retrouvailles de cet homme cabossé avec son neveu adolescent aurait pu donner lieu à quelques émotions … mais non ! Les turpitudes sentimentales dudit adolescent sont elles aussi mal traitées. La rédemption mystico-chrétienne de la maman disparue est ridicule. La violence de ce héros dans les bars reste un mystère.spoiler:  Et enfin, quand l’ex-femme du héros fait preuve d’une résilience totalement déplacée et stupide, on touche le fond ! 
The Music of Strangers, 4.0, Une œuvre rassurante qui donne l'espoir que les douleurs de ce monde pourraient être adoucies. Sous la forme d'un documentaire, jamais didactique, on suit la trajectoires de quelques émigrés de pays où ne règne pas vraiment la liberté d'expression. De belles questions existentielles concernant la musique sont posées avec acuité. Une belle phrase que l'on pourrait mettre en exergue à propos de la politique et de la culture : Qui se souvient du souverain régnant à l'époque de Beethoven ?
Sully, 4.0, Comment faire un film de 2 heures avec un événement de 208 secondes ? C.Eastwood y répond magistralement. Pour une fois, l'aviation civile est traitée ici de façon assez fidèle. Le cœur du message est ici de remettre les facteurs humains au cœur de problème. Beaucoup de questions primordiales sont ici abordées, souvent assez une grande finesse. L'homme face des choix immédiats, confiance en soi, confiance en l'autre, confiance au système, "aurais-je pu mieux faire ?", le poids de la responsabilité de vie., le partage de ce fardeau avec son binôme, avec ses collègues ... C'est sensible, précis et très bien fait.
Premier Contact, 3.5, Une vraie bonne idée que de se demander comment entrer en contact avec des êtres vivants sans aucune référence commune. Evidemment cela fait tout de suite penser aux jolies notes colorées de Speilberg dans "Rencontre du troisième type". Référence assumée par Denis Villeneuve. La première partie du film basée sur une approche plus sémiotique que scientifique est assez novatrice et séduisante. L'on voit ainsi une linguiste prendre une place prépondérante au sein d'une équipe militaro/scientifique. Vient ensuite le ventre mou du film où l'on nous rabâche les habituels clichés du genre ! Les extra-terrestres sont-ils méchant ou pas ? Evidemment, tout les "non-américains" sont des imbéciles qui ne pensent qu'à guerroyer ! Cela se passe dans une ambiance de tente d’opérations extérieures assez débilitantes. Et puis arrive le ressort (tellement utilisé dans le genre) du temps elliptique. Et là, c'est une réussite totale pour une fin pour une fin très émouvante.
Les Animaux fantastiques, 4.0, Je craignais un peu ce retour lucratif de l'industrie hollywoodienne au monde merveilleux des Potter. Eh bien, c'est une réussite totale. Le décor d'une grande ville des années 30 apporte un souffle plus urbain, plus réaliste, aux aventures épiques des différentes sectes de sorcier. J'ai passé un moment hors du temps dans ces mondes fantasmagoriques et ça fait du bien ... même si je risque d'oublietter ce moment assez vite !
Moi, Daniel Blake, 1.0, Aucun intérêt. Des tranches de vie aussi navrantes, il y en a plein les pages de notre presse quotidienne ou hebdomadaire. Certes c'est bien fait, bien construit, mais aucune surprise, tout est convenu, écrit d'avance ...
Sing Street, 4.0, Comme le cinéma britannique sait bien fabriquer les peintures sociales ! Mais ce n'est pas du Ken Loach ! La dépression économique des années 80 en Irlande sert magnifiquement de toile de fond a ce superbe "feel-good" movie. Parce que si l'espoir de s'extraire de ce marasme économique et spirituel sert de ressort à tout les protagonistes, l'angle de vue d'un adolescent apprenti musicien donne a cette description la légèreté, l'utopie, l'impertinence et la grandiloquence de cet âge. Qui ne c'est pas identifié aux "guitar héroes" de nos vinyles poussés à fond sur nos improbables pick-up ? C'est le ressort émotionnel de cette totale réussite où la musique sert de vecteur à une description subtile des premiers émois colorés sur un fond social grisâtre. Le spectateur se laisse aller à une douce euphorie délicieusement régressive.
Aquarius, 3.5, Factuellement, le film nous conte l'histoire de Clara, veuve d'un milieu aisé qui a tout vécu dans son bel appartement face à la mer, à Récife. La première heure, longue, pose le personnage, son histoire, son ancien cancer du sein, son veuvage. Puis on découvre comment elle tient tête seule au promoteur immobilier qui veut l'exproprier... seule contre son adversaire et son entourage. Et c'est un véritable siège qu'elle va tenir dans cet immeuble déserté.Les métaphores sont nombreuses mais donnent au récit une valeur romanesque indiscutable avec la nostalgie comme moteur puissant. Avec une certaine veine épicurienne on goûte tout les petits instant de la vie de cette femme amoureuse, aimante et rebelle aussi à tout ceux qui aimeraient voir éliminés les vieux - "le vieux". C'est là que réside un certain message politique contre l'agressivité d'un jeunisme destructeur, d'un capitalisme débridé.Le portrait d'une femme magnifique et sensuelle porté par la solaire Sonia Braga, d’une dignité poignante et inoubliable.
Toni Erdmann, 2.0, Face aux critiques dithyrambiques que ce film a suscitées à Cannes, je dois être un spectateur extrêmement basique pour avoir gouté aussi peu ce spectacle.Toni Erdmann, c’est le nom du personnage inventé par Winfield pour côtoyer sa fille, consultante à Bucarest, plus ou moins à son insu. Un grand échalas emperruqué et pétomane qui prend un malin plaisir à faire honte à sa fille lors des cocktails et autres "pince-fesses".On croit un moment que par l’absurde, il va la ramener à une vie moins cruelle, on pourrait croire qu’il se sauve lui-même … rien de tout cela. Le scénario évite le didactique, évite de donner des leçons.Parce que, l’art du décalage, d’être toujours là où personne ne l’attend, doit être le ressort comique du film … et je n’ai pas ri une seule fois ! J’ai bien senti les 2 heures 40 …
La Tortue rouge, 5.0, Une épure à l'état pur. Sans dialogue, les émotions sont transmises par la pureté des sons, le bruit des vagues, les bruissement des feuilles, le clapotis de l'eau. Le scénario est épais comme une feuille de papier à cigarette et c'est là, tout l’intérêt. On se laisse bercer par l'itinéraire immobile de ce naufragé tout au long des principales étapes de sa vie. La qualité de l'image, des animations, de la couleur nous transportent loin ... on se laisse aller avec délectation dans cette poésie visuelle. Chef d’œuvre !!
Love & Friendship, 3.5, Le film est présenté comme la description des prémisses au féminisme. En effet, on y voit des "ladies" brillantes et sophistiquées utiliser toutes les armes en leur possession pour influer (et survivre honorablement) dans un monde dont la gente masculine a la propriété. Le plaisir réside à regarder évoluer ces femmes aux desseins pas toujours reluisants, voir se créer les opportunités, les retournements d’intérêts. Ainsi se construit un scénario proche du « polar » tellement les précarités sont changeantes … Scénario, dialogues, photo, bande son, jeu des acteurs, tout est parfait ! Et ce charme discret et cet humour « so british » … Un vrai régal !
La Nouvelle vie de Paul Sneijder, 4.5, Un film touchant et très intelligent qui tente (et réussi) la gageure de nous faire toucher du doigt les bouleversements induits par le complexe du survivant et par le deuil d’un enfant. La première partie (à peine longue) nous décrit le cheminement intellectuel de ce cadre aisé de savoir s’il doit profiter financièrement (lui et sa famille) du douloureux décès de sa fille. La douleur, le décès, la dépression confère au héros un regard décalé sur sa vie et au-delà sur le fonctionnement social du milieu dans lequel il évolue. C’est ce regard décalé qui donne au film toute sa saveur cynique, impertinente mais poétique. Comme le décor évolue de l’hiver au printemps, on assiste à la prise de conscience de cet homme qui ne veut plus entrer dans aucune case. Ce décalage dérange dans ce monde tellement normatif incarné (de façon un peu trop caricaturale) par son épouse obsédée par les « univers à haut potentiel » qu’elle envisage avec tellement de force pour sa progéniture. Le scénario nous emmène toujours où l’on ne s’y attend pas, avec malignité, vénusté et subtilité. Un régal ludique et profond. Thierry Lhermitte est bouleversant de sobriété dans ce qui est peut-être son plus beau rôle.
L'Avenir, 0.5, La cérébralité de ce machin est exaspérante ! C’est mal joué, le scénario (famélique) est extrêmement convenu le résultat est élégiaque à en frôler la nausée ! Le deuil de la mère envahissante … on s’en fout ! Le deuil de 25 ans de couple … on s’en fout ! Les dégâts sur le psychisme des enfants... on s’en fout ! Sur la façon d'enseigner et transmettre... on s'en fout ! Le bouleversement de devenir grands-parents … on s’en fout ! La vacuité de ce récit est indicible !
Paulina, 3.5, D’abord, une performance majuscule de Dolores FONZI qui ne quitte quasiment pas l’écran pour incarner brillamment une femme troublante de force et de sincérité. Elle porte toute l’ambiguïté de sa trop belle naissance et de ces convictions équivoques. Au fin fond de la région défavorisée des trois frontières, le personnage choisi, à l’incompréhension plus ou moins véhémente de tout ses proches, de ne pas condamner ses agresseurs, condamnés qu’ils sont déjà dans la société par leur manque d’éducation. Ses dogmes intimes la mène à porter dans sa chair ce qui est (à ses yeux) de la responsabilité de la société. Ce chemin de croix de l’héroïne aurait pu être celui du spectateur, mais le discours est pertinent et la réalisation assez sobre pour le rendre plausible. Cela donne une œuvre aussi déroutante que captivante.
La Saison des femmes, 3.5, Un fragile équilibre entre différents genres mais qui tente d’échapper aux codes affidés à ceux-ci. Leena Yadav manie l’art du contre-point avec une telle dextérité que l’on évite (ou presque) les caricatures ou le discours pamphlétaire. Pour que la critique cinglante des sociétés coutumières patriarcales soit plausible, il fallait que certains hommes soient positifs, pour que l’éveil de la conscience féministe soit plausible, les réticences des quatre protagonistes sont montrées avec acuité. Ainsi ce film qui veut révéler les violences ouvertes ou larvées faites aux femmes atteint son but, même si parfois les situations paraissent outrancières. Enfin, ce qui m’a troublé, c’est que Leena Yadav nous montre que le comportement indigne de la gente masculine ne fait que s’accentuer dans la collision entre les cultures traditionnelles et numériques ; Les personnages les plus odieux sont les jeunes hommes …
Tout pour être heureux, 2.0, Une magnifique escroquerie ! Toutes les recettes de la comédie dite « à la françaises » sont employées sans parcimonie. Pour bien anesthésier la victime de l’escroquerie, il faut ; 1/ un vague décor parisien bobo 2/ Une intrigue secondaire musicale un peu folk, c’est dans l’air du temps (genre « paroles et musiques » 3/ Un papa paumé qui devient adorable avec ses magnifiques petites filles, pas trop jeunes pour éviter les couches, pas trop vieilles pour n’embêter personne avec l’adolescence. (Genre « Kramer contre Kramer ») Voilà, tous les éléments du décor sont plantés pour flatter l’empathie supposée du spectateur avec ces merveilleux protagonistes ET CA MARCHE !!Sauf que, un sale égoïste assez nombriliste pour se comporter comme un mufle avec tout le monde qui devient un père magnifique en 3 jours … une caricature de sœur qui se la pète dans sa détestation assumée, qui devient la confidente idéale … le musicien super-copain depuis vingt ans a qui l’on sort toutes les objurgations possibles … le patron de café qui sert de nounou pour les filles … le gros problème de logement qui disparaît grâce à 4 billets de concert … et les ENORMES contrariétés financières qui se dissolvent dans la vacuité du scénario … cela fini par éveiller les soupçons !! C’est pourquoi c’est une escroquerie, c’est joli, bien ficelé, très flatteur mais c’est du vol !! Ah, dernière chose … ce n’est même pas drôle !
Les Délices de Tokyo, 4.5, Voilà un film à la profondeur rare et subtile sur la richesse de la transmission entre générations : Sentaro, trentenaire alcolo/paumé/désabusé/gérant de gargote, Tokue septuagénaire solaire aux dons culinaires extraordinaires mais aux mains abimées et une collégienne rêveuse.Semblable à un mets raffiné, ce film fait la part belle au goût, à la saveur. C’est un régal de voir cette vieille dame transmettre ses secrets de fabrications de haricots rouges confits ! Dans le local exigu le cinéaste nous laisse pénétrer dans l’intimité de cet apprentissage soigneux. Si les aliments pouvaient parler, ils nous apprendraient les vertus de la patience, de l’effort. Toutes ces métaphores pour nous transmettre la saveur de l’espoir, du respect de soi et de l’autre. Et c’est ainsi que l’on voit le taciturne Sentaro retrouver de l’enthousiasme dans sa tâche ingrate. Avant d’être confronté à la cruauté du jugement collectif, à la rumeur. Et c’est encore la sagesse de Tokue, son supplément d’âme, qui l’aidera à surmonter ses fardeaux pour investir un chemin de vie plus apaisé.
Anomalisa, 1.5, La platitude et l’ennui d’un voyage d’affaire … un hôtel de luxe aseptisé sert de décor. Le rôle principal est un conférencier dont on découvre petit à petit le mal-être qu’il tente de guérir avec son ex ,d’abord, puis avec plus de succès avec une voisine de chambre complexée. Ce monsieur souffre d’une pathologie étrange : tous les personnages qu’il côtoie, même dans ses rêves, ont la même voix, le même visage. Cette affliction handicapante est parfaitement servie par la technique d’animation employée au réalisme étonnant. Chimérique et irréel ce film sur l’ennui est corrompu par son sujet ! Le récit déprimant à souhait est trop frêle pour retenir l’attention toute la durée du film.
Tout en haut du monde, 4.0, La production de dessins animés français est capable de choses merveilleuses, ce n'est pas nouveau. Avec un budget famélique, le spectateur remarque dès les premières images que les détails ne sont pas fouillés, qui les animations ne sont pas sophistiquées. Mais ces concessions financières sont vite oubliées car le souffle du film de Rémi Chayé nous emporte très loin ... dans le grand nord, servi par une colorisation exemplaire et une bande son travaillée. La banquise, les trois-mâts, le superbe chien aux yeux bleus, la rudesse des marins, l'exemplarité du capitaine ... on dirait du Jack London et cela m'a sacrément fait re-travailler l'imagination !!
Carol, 3.5, Un film d’amour, tout simplement, tout joliment ! C’est ma présentation liminaire car le film élide la satire sociale du puritanisme des années 50, la pesanteur de la religion, du conformisme. Le thème de l’homosexualité dans le contexte des années cinquante aurait pu donner lieu à une description didactique de la société empesée du moment. Mais avec une élégance rare, ce sont d’autres thèmes qui sont mis en avant ; dans une relation amoureuse, que peut-on donner ? Que peut-on recevoir ? A quoi doit-on renoncer pour rester cohérent avec ses sentiments ? Que peut-on risquer dans l’abandon a ses penchants ? Cette belle histoire d’amour, voire de fascination est magnifiquement traitée et surtout servie par un duo d’actrice époustouflant avec une mention spéciale pour Rooney Mara qui avec des faux airs de Audrey Hepburn est carrément craquante.
