Title,Rating,Review
La Chimère, 0.5, J'ai tenu quand même 40 minutes ! Et ça ne ressemble à rien ! 40 minutes de vide abyssal. Ce n'est même pas énervant ou agaçant, ce n'est rien ... La vacuité absolue !
Perfect Days, 5.0, C’est avec une grâce et une élégance indicible, une intense beauté que Wim Wenders nous livre un somptueux tableau de Tokyo à travers les yeux candides de Koji Yakusho (palme d’or). Cet homme d’entretien des toilettes de Tokyo s’émerveille de tout. Le parangon de l’épicurien ! Il s’applique à exécuter sa tâche – ingrate – avec perfection. Et W.Wenders applique au spectateur la langueur répétitive qu’il applique à son personnage principal. Au travers du refus d’une modernité fourmillante et parfois vaine (incarnée par son jeune collègue) W.Wenders nous invite avec douceur et élégance à recentrer nos existences sur l’essentiel.D’immenses « standard » des années 60 sont utilisés avec une grande pertinence ! "The House of the Rising Sun" pour illustrer les clés (la prison ?) du personnage principal, "Redondo Beach" de Patti Smith pour évoquer la tristesse d’une rupture, "Perfect Day" par Lou Reed évidemment, une superbe utilisation de "(Sittin' On) The Dock of the Bay" par Otis Redding … un réel moment de grâce du héros avec sa nièce ! Et puis les Kinks, Van Morrison et enfin, comme un résumé du film ; "Feeling Good" par Nina Simone.Et puis, par petites touches, on apprend que cette vie d’ascèse est un choix … Quand par un rappel subtil, il faut être conscient que rode la mort, alors, savourer le moment présent prend tout son sens !Un film « bonbon », qui fait l'éloge du contentement de l'instant présent. Avec, qui plus est, quelques perles d’humour totalement magiques !
L'Enlèvement, 4.5, Même si la dernière demi-heure est plus faible, cette fresque dépeint avec tellement de précision le conditionnement construit par les églises ! Cette église qui n'a de cesse de ségréguer, régir, humilier ... depuis des siècles ! Et ce n'est pas l'apanage de l'église catholique !Le mensonge et la haine véhiculés par les prélats en contradiction totale avec les textes est extrêmement troublant !Cette histoire d’enlèvement est haletante ... la description de la naissance de la république romaine, un peu moins ! Et puis ce dogme qui affirme sans controverse que le catholicisme occidental détient LA vérité raisonne "méchamment" dans l'actualité !
Le Règne animal, 4.5, Une dystopie qui inquiète (pléonasme ?) ! Un film de genre peu usité, qui étonne, qui dérange parfois ! Les effets spéciaux sont fabuleux, les maquillages ébouriffants ! C'est foisonnant d'idées, c'est poétique, onirique, très dérangeant parfois ! Heureusement, il y a des traits d'humour qui détendent l'atmosphère, parfois pesante !
Killers of the Flower Moon, 1.0, J'adore les longueurs au cinéma ... les longueurs signifiantes !J'adore les rythmes lents quand ils sont pertinents au vu du sujet.Mais là, on s'ennuie ! Mais on s'ennuie d'une force ! Alors qu'il y avait matière à faire un film superbe ... d'une heure et demi ! Avec la maestria de Scorcèse des acteurs magnifiques, une histoire surprenante, il y avait de quoi faire un film magnifique !
Les Sherpas et la paroi des ombres, 2.0, undefined
Le Sel de la terre, 4.0, Si le passage de V. Schöldorff au documentaire ne m'avait pas convaincu, celui de W.Wenders est une incroyable réussite ! En suivant depuis de nombreuses années le photographe Sébastian Salgado, il nous délivre (avec la complicité du fils Salgado) un résumé poignant de la géographie et surtout l’histoire des soubresauts de notre planète ces 40 dernières années . Qui eut cru que l'on puisse captiver des spectateurs avec un diaporama des photos noir et blanc de Salgado ?On attaque avec des photos poignantes de mines d'or ! Et l'esthétisme du N&B prend de suite tout son sens ! Salgado a tout vu, a couvert tout les conflits et ses clichés de la grande famine en Ethiopie (84/85) et des massacres au rwanda ( 1994) sont parfois insoutenables (certains sont sortis !)Mais après ce qui bouleverse et horrifie, la dernière partie est bien plus optimiste ... grâce à madame Salgado :-)
The Forest Maker, 3.0, Vu au Grand Bivouac à AlbertvilleQuand le talentueux Volker Schlöndorff s'essaye au documentaire, j'accours ! Et le sujet est magnifique ! Tony Rinaudo est un agronome australien qui a su après de nombreux essais infructueux, redonner vie, refaire pousser des arbres au Niger entre autres. Probablement le film qui correspond le mieux au thème de cette année ; Y croire encore ! Tout les thèmes sont abordés ; environnement (évidemment), politique, et les aspects sociaux et éducatifs. Une totale réussite en vue, sauf que V.Schlöndorff n'est pas aussi à l'aise dans l'exercice du documentaires que celui de la fiction ... et la facture de l’œuvre n'est pas à la hauteur de la réputation de son auteur !
Paradis, 1.5, undefined
Si seulement je pouvais hiberner, 5.0, undefined
Les Filles d’Olfa, 4.0, "Les Filles d’Olfa" nous donne l'impression, la certitude que le cinéma peut être tellement utile ! Le regard porté sur le monde est tellement différent de notre (de mon ...) regard d'européen !Le sujet traité a été vu à maintes reprises sous forme de reportage dans diverses émissions d'information. Mais, dans ce film, les faits ne sont pas le propos ! Ils sont la cause, c'est tout. Par des moyens assez inhabituels, nous sont montrés les ÉMOTIONS provoqués par les faits. Le spectateur est surpris à chaque minute parce qu'il n'y a rien de rationnel ! Le machisme, la maltraitance infantile, la sororité, les rapports mère/filles, la violence domestique, l'intimité féminine ... tout est abordé par ces femmes sous l'aspect des joies et des tourments induits ...C'est émouvant, grinçant, déroutant ...
Mongolie, la vallée des ours, 4.0, undefined
Fermer les yeux, 4.0, On a frisé le chef d’œuvre ! (d'où le 4 sur 5 !) Mais pourquoi ce film est-il si long ? Tout est signifiant ! Tout les plans, tout les dialogues ont leurs places pour évoquer le temps assassin et l'oubli.Mais pourquoi est-ce si lent ?C'est une superbe mise en abyme de l’œuvre cinématographique. Savoir caler un récit dans la bonne temporalité :Mais pourquoi est-ce si long ?Reste une ode magnifique à la nostalgie, sans aucun défaut si ce n'est que ...
L'Odeur du vent, 4.0, Une magnifique épopée au milieu d'une nature magnifique. L'histoire d'un altruisme touchant dépourvu de mots où seule l'intention a de la valeur. Le voyage est tortueux comme les routes et chemins superbement filmés.Les parti-pris sont impressionnants et servent magnifiquement le récit :- c'est donc incroyablement taiseux- très peu de musique ... mais si belle !- la caméra ne bouge jamais, ce sont les personnages qui entrent et sortent du cadre- et enfin, une lenteur du récit qui peut fortement déranger ! ... et qui m'a parfois perturbé !
L'Amour et les Forêts, 4.0, Quelle remarquable description de l'emprise d'un pervers narcissique ! Le piège inéluctable du manipulateur qui enferme petit à petit son épouse comme une araignée qui tisse sa toile autour de sa proie relève d'un processus glaçant ! Les deux acteurs sont extraordinaires. V.Efira parvient à exprimer toute la détresse des victimes qui se voient dépouillées de leur liberté au plus profond de leur espace mental. Melvin Poupaud se révèle charismatique et terrifiant dans son rôle de manipulateur à l'extrême. À travers sa présence physique, il parvient à séduire et à effrayer simultanément. Un voyage de la clarté normande au plus sombre de la forêt lorraine avant un retour vers la lumière. C'est presque trop joli.
Showing Up, 4.0, C'est drôle, c'est exaspérant, parfois pathétique. Nous faire toucher du doigt le processus de création et ses turpitude ... Une réelle réussite où l'on se demande si le laid de la vie quotidienne influence la création . Doit-on rejeter le quotidien et ses entraves s'il est vilain ? Un simple pigeon donne la réponse ....
Burning Days, 4.0, Un avant-goût effrayant de ce que devient une société où les populistes laissent en roue libre des caciques locaux faire leurs petites lois pour prospérer en toute impunité ! Alors, quand un homme de loi intègre vient tenter de réinstaurer une loi générale, tout est fait pour lui nuire.Nulle communauté n’est à l’abri du pire, de l’abominable … J’ai pensé à « mangez-le si vous voulez » de J.Teulé … Le scénario est astucieux, les tensions sociales pesantes, les tensions sexuelles subtiles … si la fin avait ressemblé à une vraie conclusion, j'aurais mis cinq étoiles !
La Dernière reine, 3.0, Puisque la reine Zaphira n'a pas d'existence avérée, on pourrait s'attendre à une belle fable orientale faisant intervenir les frères Barberousse, les ottomans, les espagnols, les berbères et les arabes ... Oui ... mais . le scénario pathétique, les décors et les costumes kitchissimes ne font guère rêver plus d'une demi-heure ... Et puis j'ai toujours autant de doute sur l'esthétisme des grands jets de ketchup, des membres coupés et autres gorges tranchées ....
Les Trois Mousquetaires: D'Artagnan, 2.0, Aux promesses de ripailles, de plumes au chapeau, de cliquetis d’éperons de fracas d’épées et de cavalcades, j’accours ! Sauf que les promesses ne sont pas tenues à cause d’une distribution disparate, d’une mise en scène illisible et brouillonne. L’esthétique sombre et les vaines tentatives de second degré ne permettent jamais au film de décoller. Tous les codes du genre sont « posés là » comme si le souci principal était de ne pas déplaire … Et c’est vrai que ça marche … un moment.Et puis, les décors de châteaux du 18ème, les traces de pneus de tracteurs dans les chemins, les tas de buches coupées à la tronçonneuse, les champs de maïs plantés à la semeuse … ça fait rire ! Déjà que l’on a du mal à « entrer » dans le film !
Sur les chemins noirs, 3.0, Un homme se répare en parcourant les chemins de traverse. De cette intrigue famélique Denis Imbert a fait un film puissant et sensible. Avec toute les limites de l'exercice de style qui consiste à faire marcher Dujardin dans les pas de Sylvain Teysson ! Mais l'esprit et surtout les mots de l'écrivain irradient dans cette errance diagonale ... Les comparaisons permanentes entre l'homme "d'avant" et celui qui marche n'alourdissent pas le propos. L'"introspection se fait avec autant de finesse que de sincérité.
Babylon, 0.5, Je ne suis pas parvenu à trouver un sens (caché?) aux scènes de défécation, d'urologie, de fornication, de jaillissement de vomi, d'exposition de monstres, de meurtres gratuits ...Tout est factice, tout sonne faux ! La trajectoire écrite de quatre personnages sans surprise. Il y a tant de film où ses sujets ont déjà été traités ! Mieux !Le seul but serait de nous déranger avec des scènes outrancières ? Pendant 3 heures en plus.
Armageddon Time, 1.0, Eh beh ! C'est soporifique à souhait ! Mais aussi très convenu, très convenable, très académique. Tout les sujets traités semblent avoir déjà été abordés avec bien plus de pertinence. Le racisme systémique américain, l'inégalité des chances, la difficulté a échapper à son milieu, les rêves d'enfance brisés. Même l’ambiance des années 80 est mal reproduite ...La distribution irréprochable sauve cette bluette indigeste.
Close, 4.0, Un film en deux parties, touchant, troublant et parfois trop lent. Deux adolescents très proches, trop proches ? Des gestes, des silences, des complicités qui sèment le trouble dans leur entourage et chez le spectateur. Les deux ados sont magnifiques et talentueux. Dans un monde rêvé ou les parents sont sensibles, à l'écoute, où le collège est un lieu d'écoute et d'échange, où le vestiaire de hockey est bienveillant la complicité des deux garçons attire l'attention. Hors ses réserves, le traitement de cette complicité est magnifiquement abordé. La deuxième partie illustre magnifiquement les dégâts du silence, des non-dits sur la psyché de l'adolescent. Une distribution remarquable dominée par deux acteurs adolescents brillants.
EO, 3.5, Un film, voire une expérience cinématographique qui relève le défi d’observer l’humain à travers le regard d’un âne ! Des images étonnantes une bande sonore métallique, bruyante qui cogne, qui hurle ! Un poème visuel et audio qui n’épargne aucun travers l’homo-sapiens, la violence, l'envie, le rejet et surtout la bêtise de « l’homo supportis footiens » ! Et puis apparait, on ne sait pourquoi, Isabelle Huppert et le film perd de son souffle ! La fin n’est pas à la hauteur des promesses de la première heure … dommage
Les Enfants des autres, 1.0, Quand Virginie Efira est à l'écran, je mets systématiquement une étoile bonus ! Voyez ce qu'il reste pour le film ! Il y avait très longtemps que je n'avais pas regardé ma montre aussi souvent ! Je n'ai pas été du tout sensible à cette description lénifiante de la relation de deux quadras en plein doutes. ATTENTION ... le sujet semble être plus sur le désir d'enfant quand l'horloge biologique tourne que sur "les enfants des autres" ...
Revoir Paris, 3.0, Un film avec Virginie Effira ne peut pas être mauvais ! C'est MON parti-pris. Ceci étant posé, le film est plein de sensibilité, de bons sentiments ... et de résilience, ce mot tellement à la mode ! Certaines scènes tirent les larmes mais dans l’ensemble, ça manque de rythme. La volonté de montrer qu’une reconstruction psychologique ne peut se faire qu’à plusieurs est très louable. Mais alors, peut-être eût-il été préférable de ne pas troubler le message avec une romance inutile.
Les Nuits de Mashhad, 5.0, Dès la première minute, Ali Abassi nous « prend par la main » dans cette descente dans les bas-fonds de Mashhad, au plus profond de l’âme d’un tueur, dans les bas-fonds de l’âme humaine. Et il ne nous la lâche pas jusqu’à la fin !La description des meurtres est glaçante et affreusement réaliste. La personnalité du tueur, ancien combattant, nostalgique des solutions extrême est troublante. Mais le plus passionnant reste la description de cette civilisation millénaire aux fonctionnements pour le moins déroutants – pour nous occidentaux. Ali Abassi nous confronte à une autre vue du monde, de la justice, de la morale. Une piqure de rappel violente et bouleversante que les paradigmes qui gèrent notre société occidentalo-chrétienne ne sont pas universels … ni même planétaires. C’est ainsi qu’un peuple en arrive à justifier des assassinats de femmes, crimes moins grave que d’offenser Dieu en (sur)vivant de ses charmes !Si Mehdi Bajestani est troublant dans le rôle du soldat traumatisé et fanatisé, Zar Amir Ebrahimi est bouleversante en journaliste investie. Par sa conscience, elle porte le film. Magnifique performance !
La Nuit du 12, 1.0, Dès le générique, nous sommes prévenus ; il s’agit d’une enquête policière non résolue ! Donc, nous sommes invités depuis la première seconde à se désintéresser totalement de l’enquête. Alors, nous sommes conviés par une mise en scène « laser » à nous intéresser aux protagonistes du commissariat. C’est aussi intéressant que les sempiternels documentaires réalistes sur les policiers municipaux de Perpignan, les gendarmes de la Grande de Motte en été, etc. … etc. … qui envahissent la TNT ! Alors, reste le message féministe asséné à grand coup d’apophtegmes approximatifs et aussi fins que « elle est morte parce que c’est une femme ! ». Mais il y a aussi « le mariage c’est l’enfer, mais pour un policier, c’est un suicide » ou encore « les ¾ des policiers sont des bourrins » élégamment énoncé par la caution « minorité visible » du commissariat incarnée par Mouna Soualem. Bref, c’est lourd … très lourd ! Et terriblement ennuyeux !
As bestas, 4.0, Si l’on mesure la qualité d’un film à la qualité des portraits des méchants ; ce film est un chef-d’œuvre ! Mais comment j’avais envie de les châtier ces gr… c… ! Parce que le sujet du film, c’est l’entêtement de deux frères, têtes à claques, têtus et prêts a tout pour sortir de leur condition sociale paysanne misérable. Mais la dextérité du scénario est de réussir l’exploit de nous fournir des explications (excuses ?) acceptables a ces deux « bas de plafond » dans leur haine inexpugnable envers un couple de nouveaux paysans bio, intellectuels, étrangers, bobos à souhait … Donc, le choc de 2 cultures, de 2 visions de l’existence … Mais le film ne s’arrête pas une fois que l’irréparable a été commis. Et cette dernière partie permet de poser un regard interrogateur sur la notion flexible de justice, de légitimité, de justification des actes.
Decision To Leave, 3.0, Comment dire ? C'est superbe, maitrisé, charmant, émouvant, étonnant ... Des jeux d'acteurs et actrices époustouflants ! Mais je n'ai rien compris ! A force de narrations décalées dans le temps, de superpositions d'histoires, de sous-entendus ... moi, je me suis retrouvé totalement perdu ! Et comme c'est un thriller, c'est carrément dommageable.
Elvis, 4.0, Grâce à une bande son époustouflante, il nous est présenté un film opératique brillant. Le personnage du colonel Parker prend quasiment le pas sur celui d'Elvis. Cela nous permet d'apprendre des tonnes de détails méconnus (par moi!) et d'éviter les poncifs de la star déviante de par sa solitude au pinacle. Le film dépeint avec une rare violence les démons de la société américaine sur presque 3 décennies. Racisme, évolution des mœurs ... cela résonne furieusement avec l'actualité !
L'école du bout du monde, 3.0, Le sujet "bateau" du jeune insouciant qui chemine vers une prise de conscience de ses racines et sa culture ... C'est proprement fait, sans afféterie. Mais par souci de simplicité, il manque un souffle épique ! Cela reste une formidable carte postale de ce royaume anachronique où le roi lui-même (Jigme Singye Wangchuck) a imposer une démocratie parlementaire qui peine furieusement à gérer le lourd héritage du BNB ! En fait, cette belle histoire qui se situe sur le parcours du Snowman trekking n'apporte pas grand chose à un joli documentaire sur les hautes vallées du Bhoutan. ...
Top Gun: Maverick, 0.5, Je ne m’attendais pas à un film intellectuel, mais là … c’est affligeant !- Ed Harris et Val Kilmer l’ont bien compris ; 3 minutes chacun et « basta ». Dans le fil du film – il n’y a pas de scénario – les images du premier volet sont convoquées avec insistance, érigées en référence indépassable et dupliquée machinalement. Sinon, rien ne nous est épargné : le patriotisme nauséabond, le machisme exacerbé (non mais, cette histoire d’amour inutile … quelle plaie !) , honneur, patrie, fidélité à l’image du père … C’est en fait une hagiographie au producteur Tom Cruise ; - Tom Cruise vole à Mach10- Tom Cruise fait de la moto sans casque- Tom Cruise n’a pas un cheveu blanc à 60 ans- Tom Cruise a toujours un sourire ravageur- Tom Cruise est indispensable à l’armée américaine- Tom Cruise crispe magnifiquement de sa mâchoire- Tom Cruise sait gérer les tropismes des australopithèques qu’on lui a collés pour faire une équipe de pilotes- Tom Cruise à 60 ans, est encore le meilleur pilote du monde- Tom Cruise à 60 ans a encore un corps de rêve pour jouer au football américain … torse nu sur la plage- Tom Cruise à 60 ans encaisse encore 9 G de facteur de charge- Tom Cruise est le seul à pouvoir sauver l’AmériqueSinon, les vues prises dans le cockpit sont extraordinaires ! Aussi bien que celles diffusées par « No room for error » …
Les Passagers de la nuit, 2.0, Juin 2017, le film ; « AVA » de Léa Mysius, un peu passé inaperçu, m'avait bouleversé par la 1ère apparition à l'écran d'une certaine Noée Abita. Après quelques apparitions, 5 ans plus tard, la voilà qui éclaire ce film de toute son aura magnétique ! Cette peinture des années 80, traine en longueur pendant au moins 40 minutes avant l’apparition d’une jeune paumée plus ou moins SDF, nommée Talulah, incarnée par Noée Abita. Le film devient alors plus sensible, plus sentimental. La description de la mentalité des années Mitterrand est très bien rendue, malgré l’absence notable de toute référence au SIDA. Mais cela ne saurait cacher la langueur lénifiante qui s’abat sur le spectateur pendant la plupart du temps. Sans Noée Abita, c’était un naufrage ! (et une étoile de moins !)
Les Folies fermières, 2.0, Bon, vouloir voir un film dont on connait la fin heureuse, c'est de la bonne humeur assurée ... Et, ce film diffuse de l'espoir, de la bonne humeur, de la bienveillance. Mais cela ne suffit pas. Un vrai manque de rythme, de liant fait que l'ont décroche souvent, même trop souvent. Si Alban Ivanof, ne fait pas du Alban Ivanof (merci), les autres personnages sont bien trop caricaturaux et manquent furieusement d'épaisseur. Le banquier est retors à souhait, le papy grincheux est vraiment TRES grincheux, la chorégraphe "sergent chef" est vraiment TRES autoritaire, la quinqua sympa est vraiment TRES sympa ... etc. ... Cela reste un bon divertissement dont il faut vite que j'écrive la critique avant de l'oublier !
Contes du hasard et autres fantaisies, 4.0, Ryūsuke Hamaguchi m'avait déjà "scotché" avec "Drive My Car", il est de retour avec un film sensible et délicat où des femmes bousculées dans leur quotidien par des hasards (d'où le titre !) livrent leurs émotions, leurs états d'âmes, leurs désirs ... 3 petits films, 3 situations différentes bâties avec la même architecture. Une situation banale, voire ennuyeuse, (d'où 4 étoiles et pas 5 !) qui bascule quand le hasard vient ébranler la banalité. L'économie de moyens, de décors met en exergue le sens des mots, parfois bouleversants ... c'est superbement filmé, mais surtout magnifiquement écrit.
L’Ombre d’un mensonge, 5.0, Un diamant de romantisme ! Trois personnages, sobres, délicats, sombres et plein de mystères. Il y a d’abord l’île de Lewis, filmée magnifiquement, sans fard ni concession. Puis il y a Phil. Un homme robuste mais qui se relève avec fragilité d’un avc qui lui a fait perdre la mémoire. Il a la sagesse qui va bien avec les poils blancs de sa barbe fleurie. Son retour sans mémoire à son quotidien se fait à tâtons, avec délicatesse et une candeur adolescente. Et le personnage principal austère d’Emily (surnommée « le glaçon »!). Tout le récit – intemporel – consiste à montrer comment les deux protagonistes sont conditionnés par ce milieu pesant et empesé, par la brièveté de l’existence, le pardon, la commisération. Juste magnifique !
À plein temps, 0.5, Épuisant ! Suivre la magnifique et irréprochable Laure Calamy dans ses turpitudes domestiques, dans ses courses folles pour prendre un train, dans ses stress professionnels … Au bout de 20 minutes, le spectateur est éreinté ! C’est à peu près le moment où l’on se demande s’il va se passer quelque chose. La réponse arrive 70 minutes plus tard ; il ne se passe RIEN !
Nightmare Alley, 3.5, Ouff ... une descente vertigineuse dans la noirceur de l'âme humaine ! Le film patine un peu tant que l’action se passe dans le cirque. Mais, la deuxième partie qui se passe à New-York est magistralement maîtrisée. Les ressorts psychologiques sont complexes, désespérants et effrayants. Il en devient difficile de faire la part des choses entre le malaise laissé par le scénario et la maestria avec laquelle il est nous est montré !
Licorice Pizza, 2.0, Tu me suis, je te fuis. Tu me fuis, je te suis. C’est l’adage qui caractérise l’idylle entre Gary, 15 ans, et Alana, 25 ans. Un couple d’une irrésistible complexité dans l’Amérique déjantée des années 70. Mais cette idylle n’est qu’un prétexte qui sert de fil conducteur à une description acerbe et cynique de la société américaine de ces années-là. Il faut du temps au spectateur pour comprendre qu’il n’y a pas d’histoire – ou si peu – qu’il faut juste savourer ces saynètes pour ce qu’elles sont. Quand on a compris qu’il ne faut chercher aucune vraisemblance parce que c’est la folie qui est le trait principal de la narration, alors on peut gouter l’irrévérence des situations qui se succèdent sans forcément de liens les unes avec les autres … Ce sont les apparitions délicieuses de Sean Penn et Bradley Cooper qui font décoller la folie furieuse du récit.IL ÉTAIT TEMPS !! Parce que jusque-là, on se demande un peu ce que l’on fait devant cet écran ! Ces défauts majeurs dans le rythme de la narration gâchent HÉLAS le propos critique. Parce que, tout y passe ! Les comportements machistes, le rapport du pouvoir et de l’argent, les réalisateurs de cinéma véreux, les stars capricieuses, l’entreprenariat sans aucune éthique, et bien sûr, la politique.Cooper Hoffman et Alana Haim portent ce film décousu au bout de leurs bras et de leur talent !
